{
  "affected_by_run_failure": true,
  "anonymous_arm_id": "ARM-C",
  "case_id": "CASE-004",
  "evaluation_id": "PHASE-002-FIRST-ROUND",
  "identity_revealed": false,
  "observation_hash": "157a5674b55a20a77998716ac40cbefe1a2544040253a6014dd78c208ca94b84",
  "observation_path": "evals/results/phase-002/observations/ARM-C/CASE-004/run-001.json",
  "original_completion_status": "FAILED",
  "original_run_preserved": true,
  "original_schema_valid": false,
  "raw_output_hash": "4d7e22be835e1e5744d008f660c8e5bbc74cf38246c464d09c9c93d0ae8c3074",
  "recovered_at": "2026-08-31T09:47:15.302353Z",
  "recovery_id": "RECOVERY-ARM-C-CASE-004-RUN-001",
  "recovery_implementation_commit": "8c63674c48e3b21f13f4b46de8f94d22022e9384",
  "recovery_reasons": [
    "ARTIFACT_DESCRIPTION_FALSE_POSITIVE"
  ],
  "recovery_status": "RECOVERED_FOR_SCORING",
  "run_index": 1,
  "schema_version": "1.0.0",
  "source_run_hash": "7671467912b6fdd4dabb890ddf198fc846f4133cdedc0cf495e3ba039c2a6633",
  "source_run_path": "evals/results/phase-002/runs/ARM-C/CASE-004/run-001.json"
}
